{
  "id": "usave-attrage",
  "gateway_vehicle_id": "gw_usave_1",
  "provider_vehicle_id": "us_001",
  "source": "usave",
  "provider_code": "usave",
  "display_name": "Mitsubishi Attrage, Automatic",
  "brand": "Mitsubishi",
  "model": "Attrage",
  "category": "economy",
  "image": "https://example.com/usave/attrage.jpg",
  "specs": {
    "transmission": null,
    "fuel": null,
    "seating_capacity": null,
    "doors": null,
    "luggage_small": null,
    "luggage_medium": null,
    "luggage_large": null,
    "air_conditioning": null,
    "sipp_code": "EDMR"
  },
  "pricing": {
    "currency": "EUR",
    "price_per_day": 16.43,
    "total_price": 49.29,
    "deposit_amount": 250.0,
    "deposit_currency": "EUR",
    "excess_amount": null,
    "excess_theft_amount": null
  },
  "policies": {
    "mileage_policy": null,
    "mileage_limit_km": null,
    "fuel_policy": null,
    "cancellation": null
  },
  "products": [],
  "extras_preview": [],
  "location": {
    "pickup": {
      "provider_location_id": "354",
      "name": "Casablanca Airport (CMN)",
      "latitude": 33.3675,
      "longitude": -7.58997
    },
    "dropoff": {
      "provider_location_id": "354",
      "name": "Casablanca Airport (CMN)",
      "latitude": 33.3675,
      "longitude": -7.58997
    }
  },
  "data_quality_flags": [
    "unknown_transmission",
    "unknown_fuel",
    "unknown_seating_capacity",
    "unknown_doors",
    "unknown_luggage_small",
    "unknown_luggage_medium",
    "unknown_luggage_large",
    "unknown_air_conditioning",
    "unknown_mileage_policy"
  ],
  "pricing_transparency_flags": [],
  "ui_placeholders": {
    "image": false
  },
  "booking_context": {
    "version": 1,
    "provider_payload": {
      "booking_token": "usave-booking-token"
    }
  }
}
