{
  "id": "adobe-kia-picanto",
  "gateway_vehicle_id": "gw_adobe_1",
  "provider_vehicle_id": "adobe_picanto",
  "source": "adobe",
  "provider_code": "adobe",
  "display_name": "Kia Picanto AT",
  "brand": "Kia",
  "model": "Picanto",
  "category": "economy",
  "image": "https://example.com/adobe/picanto.jpg",
  "specs": {
    "transmission": null,
    "fuel": null,
    "seating_capacity": null,
    "doors": null,
    "luggage_small": null,
    "luggage_medium": null,
    "luggage_large": null,
    "air_conditioning": null,
    "sipp_code": null
  },
  "pricing": {
    "currency": "USD",
    "price_per_day": 29.87,
    "total_price": 89.61,
    "deposit_amount": null,
    "deposit_currency": null,
    "excess_amount": null,
    "excess_theft_amount": null
  },
  "policies": {
    "mileage_policy": "unlimited",
    "mileage_limit_km": null,
    "fuel_policy": null,
    "cancellation": null
  },
  "products": [],
  "extras_preview": [],
  "location": {
    "pickup": {
      "provider_location_id": "SJO",
      "name": "San Jose Airport",
      "latitude": 9.99386,
      "longitude": -84.2088
    },
    "dropoff": {
      "provider_location_id": "SJO",
      "name": "San Jose Airport",
      "latitude": 9.99386,
      "longitude": -84.2088
    }
  },
  "data_quality_flags": [
    "unknown_transmission",
    "unknown_fuel",
    "unknown_seating_capacity",
    "unknown_doors",
    "unknown_luggage_small",
    "unknown_luggage_medium",
    "unknown_luggage_large",
    "unknown_air_conditioning"
  ],
  "pricing_transparency_flags": [],
  "ui_placeholders": {
    "image": false
  },
  "booking_context": {
    "version": 1,
    "provider_payload": {
      "category_id": "ADO-ECON"
    }
  }
}
